,appID,body,recordID,relevant,reviewID,score,timestamp,title,Potential or Activity,Victim/Abuser/Third
57,384830320,"my mother made everyone in the family get this app. she freaks out when the app doesnt do its job because of random obstacles that mess with the location accuracy. Drains the battery and makes my parents paranoid to know where i am at all times. i dont even do any bad stuff, yet years of trust building are being swept away by the ability to spy on the children of a household. if youre a parent i highly recommend you dont get this app because it is extremely uncomfortable to have and it makes parents trust their children less",20430,,2306311075,,2018-03-14T21:03:20Z,this app basically ruined my family to an extent,A,V
2,384830320,My mom uses this app to stalk my angry move. What angry parent made this app?,20544,,2268385129,,2018-03-04T02:23:43Z,Lt. Dan,A,V
158,384830320,I can stalk my whole family all the time!!,21267,,2018823241,,2017-12-23T00:08:36Z,👀,A,A
249,384830320,My mom is stalking me thanks to you guys XD,21474,,1968941901,,2017-12-04T03:51:19Z,Geez,A,V
174,384830320,Nothing wrong with the app but my dad uses it to spy on my every move and it's so annoying 🙄😒 honestly wish this app would be taken off the App Store so I could make my own decisions.,22317,y,1691665741,,2017-07-21T08:44:15Z,Fine,A,V
199,384830320,"I read the negative review from a cry baby teenager who&#39;s parents care about their ungrateful, sorry behind and if they feel that way that shows they are guilty and obviously are going places where they shouldn&#39;t. I will say this is a great app. I don&#39;t use it to spy on anyone, it&#39;s just good to know when I drop my kids off to their grandparents and they decide to go somewhere I can see where they are in case of an emergency. It also alerts me when they leave school and arrive at home from the bus which is a very nice feature. It just gives me a peace of mind that they are safe and they are easy to get to if need be. If anyone has a problem with apps like this that&#39;s because they have something to hide and have cruel intentions behind it. My family and I care about each other&#39;s safety and that&#39;s what this app is for.",22700,,1792784479,0.024778205,2017-09-16T12:58:53Z,Great app,A,T
125,384830320,I like having this app because it allows me to know where my child is at all times! I don't think that this app should be used to spy on children or young adults/young teenagers however it is a good tool to have just in case your teenager does break down and they are not sure exactly where they are at.,22866,y,1665542401,,2017-07-02T02:50:24Z,Life360 made my life easier,A,T
18,384830320,this app is a so annoying i don&#39;t want my family stalking me,23026,,1773203260,,2017-09-04T16:00:26Z,hate,A,V
228,384830320,"This makes it so easy to spy on crazy family members or children or crazy family
members that act like children.",23156,,1762016649,,2017-08-30T17:00:49Z,Love it a lot,A,A
289,384830320,I can spy on my family all day!!,23219,,1757796196,,2017-08-28T23:41:57Z,This app ROCKS!!!,A,A
223,384830320,Great app for tracking people. Like your family or spying your husband hahaha,23358,,1743975164,,2017-08-24T03:30:12Z,Pretty legit,A,A
182,384830320,"This app is a terrible app. All
It is for is to be spyed in by your parents. It's annoying.",24128,y,1609622108,,2017-05-09T22:45:43Z,I hate this app,A,V
158,384830320,I love it. Now I can spy on my family when they lie about where they are. I LOVE IT,24256,,1693724914,,2017-07-22T18:06:45Z,Life360,A,A
120,384830320,"Great app for ""spying"" on your family and keeping track of teens",24557,y,1591982434,,2017-04-18T17:56:37Z,Big brother,A,A
13,384830320,I like having this app because it allows me to know where my child is at all times! I don&#39;t think that this app should be used to spy on children or young adults/young teenagers however it is a good tool to have just in case your teenager does break down and they are not sure exactly where they are at.,24830,,1665542401,,2017-07-02T02:50:24Z,Life360 made my life easier,A,A
32,384830320,I started using this last year to spy on my fiancé and now my whole family is using it. We love it!,25322,,1643622354,,2017-06-14T03:42:13Z,I love it,A,A
4,384830320,"This app is a terrible app. All
It is for is to be spyed in by your parents. It&#39;s annoying.",26090,,1609622108,,2017-05-09T22:45:43Z,I hate this app,A,V
173,384830320,Me and my friends use this app so we can stalk each other since we dont have kids. Its fun,27876,,1537893284,,2017-02-05T16:05:52Z,Stalker app,A,A
206,384830320,I love that I can spy on my man no matter where he is!,28148,y,1452436540,,2016-09-19T15:45:28Z,Spy,A,A
233,384830320,"Some may call it stalking, I call it LOVE:). I think it&#39;s kind of hard to set up, I have 6 or 7 different circles because it&#39;s so hard to add someone to an existing circle. Like the alerts: know when child arrives at school, hubby reaches home, etc. Is invasive, but I can&#39;t help it, I like it.",28296,,1522891116,0.012937204,2017-01-15T18:39:26Z,LIKE IT!,A,A
243,384830320,I love this app with this I can keep eye on my kids and spy on gf,30148,,1450985966,,2016-09-17T04:40:41Z,Great app,A,A
291,384830320,This app is super stalker-ish and I am not comfortable with this.,30574,,1440757797,,2016-08-28T16:57:08Z,Bad,A,V
277,384830320,I can spy on my husband lol,31050,,1413599013,,2016-07-17T01:44:44Z,Spy,A,A
50,384830320,This app is useless and it just helps overprotected parents spy on their sad kids,31114,,1408660202,,2016-07-10T01:04:38Z,I HATE THIS,A,V
49,384830320,"Don&#39;t let your parents get this app, you will be followed and stalked and it will ruin your high school life tbh.",31220,,1403081296,,2016-06-30T17:24:51Z,"Terrible, it's a stalker app",A,V
207,384830320,Great app to stalk your teenagers with! Love it!,31788,,1377701428,,2016-05-13T01:27:46Z,Life360,A,A
40,384830320,I don&#39;t want to stalk my family but sometimes it&#39;s nice to know where they are and this app works really well.,32508,,1353572964,,2016-03-26T01:10:26Z,Great tool,A,A
33,384830320,"Just needs a little tweaking with the location accuracy but other than that I use it to spy on my family, especially on those long cold winter nights when nobody's home. 😞",32951,y,1285202268,,2015-11-11T17:50:53Z,Great App!,A,A
246,384830320,"this is the worse app ever made. I have no life and my parents are always looking at this thing. how am I supposed to be living my life to the fullest if I&#39;m being stalk by parents all the time! getting multiple text saying, &#34;where are you&#34;,  &#34;what are you doing&#34; and &#34;you didn&#39;t tell me you were going there&#34;. if your a kid and your parents just got it, your life is over. my sister didn&#39;t have it in high school and she got away with everything!! it&#39;s absolutely ridiculous! don&#39;t download it!",33303,,1329649809,,2016-02-08T05:06:10Z,life ruiner !!!!,A,V
165,384830320,"Yay, now I can spy on my husband!!!",34199,,1303940451,,2015-12-21T14:58:47Z,Best app ever,A,A
98,384830320,So much better than &#34;find my iPhone &#34; and having to log into and out of my kids&#39; accounts. I love the history feature. My kids say it&#39;s creepy and I&#39;m being a stalker. I don&#39;t disagree but it is really nice and convenient to be able to keep track of my kids.,34298,,1300272540,,2015-12-14T01:15:00Z,Love it!,A,A
198,384830320,"This really is the perfect app for keeping track of teenage family members.  It&#39;s  not accurate enough to be a creepy stalker app, but it&#39;s plenty to keep teens honest. 
And great fun to tune into my extended family across the country.",34829,,1286188770,,2015-11-13T22:58:41Z,Perfectly imperfect,A,A
233,384830320,This app is great for an app that is free.  It doesn't update as fast as find my iPhone but it works when you need to know where someone's headed and for how long they've been there.  Spying on a boyfriend or watching a daughter or young son this app is perfect.,34953,y,1177200480,,2015-04-03T12:20:47Z,Life 360,A,A
193,384830320,Easy to stalk my family!,35795,,1263154410,,2015-09-26T17:45:22Z,Love it!,A,A
283,384830320,This is a great app to spy on my family with! 😃,36244,,1253097800,,2015-09-04T18:26:36Z,Life 360,A,A
161,384830320,"I love this app because you can find out where your family is without having to ask where they are. I would've never known where people are. Instead of worrying where people are, I just know where they are without a doubt, and I could spy on people. 👀👀👀👀👀👀",36494,y,1118960649,,2014-12-25T13:29:28Z,BEST APP EVER!!!!!!!!!!!!!,P,T
32,384830320,Not a very good app. I was laying in my room and I got yelled at because the app said I was somewhere else but really I was just watching Netflix in my room. I can&#39;t even go out to dinner w out my mother stalking my every move. Do not let your parents download this app- parents if you love your kids don&#39;t download it.,36512,,1233320215,,2015-07-26T09:38:05Z,Kiss your life goodbye,A,V
3,384830320,It&#39;s a great app to stalk your children with.,36614,,1215411245,,2015-06-21T02:20:31Z,Yes,A,A
187,384830320,This app is great for an app that is free.  It doesn&#39;t update as fast as find my iPhone but it works when you need to know where someone&#39;s headed and for how long they&#39;ve been there.  Spying on a boyfriend or watching a daughter or young son this app is perfect.,36908,,1177200480,,2015-04-03T12:20:47Z,Life 360,A,A
65,384830320,"This is an app used by overly nosy parents to spy on their kids, it's ok to be nosy, but do you really need to know where your kid is, at all times? As a kid who was a victim to this app I can tell all you parents this is just going to make your kid more sneaky, they will leave their phone somewhere and not tell you anything because they know you are spying on them",37080,y,1101256456,,2014-11-22T17:28:46Z,Nosy parents,A,V
80,384830320,Well it is not very accurate all the time but it is a great app for your family and husband to stalk you! ^_^,38290,,1121289467,,2014-12-29T18:28:23Z,Good app for stalkers,A,V
85,384830320,I like it a lot I can stalk my family!!!!😏,38814,,1109510745,,2014-12-07T18:57:29Z,Fun,A,A
8,384830320,"This is an app used by overly nosy parents to spy on their kids, it&#39;s ok to be nosy, but do you really need to know where your kid is, at all times? As a kid who was a victim to this app I can tell all you parents this is just going to make your kid more sneaky, they will leave their phone somewhere and not tell you anything because they know you are spying on them",39031,,1101256456,,2014-11-22T17:28:46Z,Nosy parents,A,V
129,384830320,"I recommend to everyone. Before this app I used google locator, but since they closed their app, this locator is the best. You can spy or just to be sure that your kid in safe place. Thanks!",39718,y,1004023586,,2014-06-04T02:58:35Z,The best in App Store!!!,A,A
1,384830320,My sisters and my mom love the app. We are able to keep track of each other on this. We stalk our mom this.,39997,,1066071423,,2014-09-18T03:08:55Z,Love the app,A,A
38,384830320,"I hate this app so much! My mother is always questioning me and if I delete it she will ground me I&#39;m so pisses at who ever made this friggin app!!!😡😡
No one want their parents to stalk them!!😡😡",40139,,1059072336,,2014-09-05T00:23:20Z,I hate this app!!,A,V
154,384830320,Great way for your mom to stalk you.,40544,,1042043318,,2014-08-07T04:08:00Z,No,A,V
7,384830320,I think this app is fun to stalk your family!!!! And it works really well and useful!!!,40624,,1038649407,,2014-08-01T09:46:03Z,Fun app,A,A
51,384830320,Love that I can stalk my whole family! Muahahahaha! 😜,40659,,1037275752,,2014-07-30T01:31:39Z,Love it!,A,A
292,384830320,This app has changed for the better over time and is a very good option for stalking my family members.,41824,,995601672,,2014-05-19T23:04:01Z,Much Improved,A,A
218,384830320,My mom put this app on my phone without me knowing. This app is only used for spying and is an invasion of privacy.,41852,,994115241,,2014-05-17T04:27:35Z,Not good,A,V
42,384830320,"O_o This app is so incredible! It actually lets u know what crimes are going on & where they are located! Plus, now spying girlfriends/wives have just gone to a whole new level! ;)",42912,y,808865400,,2013-05-22T23:05:00Z,Outstanding!!!!,A,A
145,384830320,Simple way to turn an old droid or iPhone into super spy GPS tracker gear.,43007,y,804892734,,2013-05-15T07:38:43Z,"Easy, straight forward, and very reliable",P,T
295,384830320,This app is great. Don&#39;t get it though. Don&#39;t let your mother talk you into getting it. She will stalk you just like mine does. I don&#39;t mind though. Awesome app though.,43235,,872602119,,2013-09-19T20:44:48Z,Yeah. Only three stars.,A,V
28,384830320,I love how parents are stalking their kids now lol ... This app is awesome,43700,,850242223,,2013-08-07T22:04:46Z,5 *,A,A
212,384830320,This app is pretty cool in a far out kind of way. Now I can spy on my family. 😎,43939,,837866170,,2013-07-17T02:06:17Z,Excellent!,A,A
78,384830320,Love spying on my siblings and friends... Bwahahahahahah,44855,,808803557,,2013-05-22T20:00:11Z,Great app,A,A
13,384830320,"What can I say,work very well,it's good tool to spy your partner every time =.=",45198,y,741920134,,2013-02-01T21:14:36Z,Work well,A,A
41,384830320,Love stalking my family!,46418,,763823624,,2013-03-05T00:28:01Z,Love it!,A,A
109,384830320,perfect app for stalking all of my ex girlfriends,46792,,752939059,,2013-02-17T06:18:12Z,great app!,A,A
247,384830320,I dislike the idea of this app in any use but a emergency situation. This gives my mom a new way to spy on me.,47682,y,666705657,,2012-09-30T03:01:52Z,Creepy.,A,V
200,384830320,Love it! Great to stalk family members lol,47778,,724378266,,2013-01-07T02:08:37Z,M2M,A,A
84,384830320,A great stalker app. I know where my family is 24-7!!,49701,,665083228,,2012-09-26T21:44:29Z,Love it,A,A
191,384830320,It works for what I need it for... To spy on my wife! But it is off 10-15% of the time!,51062,,626199779,,2012-07-21T01:25:19Z,Could be more accurate,A,A
116,384830320,This is an app for creeps who wanna stalk other people,51256,,618480404,,2012-07-09T03:12:11Z,Garbage,A,V
193,384830320,Awesome app now I can have my girlfriend stalk me everywhere I go&#34;/,51694,,601347372,,2012-06-13T16:16:56Z,Awesome!!!!,A,V
229,384830320,"This is a great app, but it is kinda like a stalking device",52483,,536053224,,2012-02-29T16:51:01Z,Stalking app,P,V
265,384830320,"Now, it is very accurate, it shows exactly how many feet within the are is the person, great for spying people, family use, and possibly a cool little toy!",52995,,478692826,,2011-11-05T15:08:46Z,The update fixed everything!!!!,A,A
41,542203931,"It's good for safety for your children and all, but doesn't it seen like no trust in your children and no privacy for your kids? It's basically spying on everything they do. Ye",57238,y,1103841849,,2014-11-27T03:54:33Z,Not sure..,A,V
236,990229433,"Anyone who has looked at multiple tools like this will appreciate the detailed possibilities with Qustodio. The problem lies in execution. 

Support is pretty lame and their answer is always “reinstall the app” which means that delightful fight you had with your kid about spying on them will be repeated over and over. 

Overall a great tool for monitoring a willing subject that desires accountability but get ready for repeated conflict when using it with someone who resents it.",57935,y,3857203318,,2019-03-08T14:45:47Z,Potential for greatness but major misses,A,A
292,967986300,I wish to have a full app like SPYZIE  and discreet without knowing it,58065,,4967696373,,2019-10-18T16:32:05Z,app with basic function,P,T
114,917089298,"Using the app was a complete waste of time. So I came in contact with this great genius hacker via; globaltrackandspy ( @ ) gmaillcom who is trusted 100% and very effective. I've gotten help from their team to hack my spouse cellphone without having access to the phone. They can hack into any-form of problem you want solved such as call logs, texts, GPS, deleted contents and social media apps at a very affordable cost. I was so happy to come in contact with the right team for the very first time.",59150,y,4923420679,,2019-10-11T13:22:29Z,Best Help!!!,P,A
165,542203931,"Although it has limitations, this is a pretty good app.  It notifies me when my kid tweets or posts on Instagram or FB--without my having to go into those sites one by one. It also notifies me when he arrives at school, leaves school, etc.  pretty awesome for an overprotective mom. 

Disadvantages--it only works over data, so if you have a cheap cellular only plus wifi plan with no data--as I do and probably a lot of people do as they are cheaper--it is less useful as you only get the notifications when your kid connects to wifi.  However, ALL of these big brother apps work this way...believe me I have checked. 

Your kid will know you are watching, so it&#39;s not super stealth or anything.  

Anyway, overall pretty good and I would recommend based on a weeks use.",59326,,1190909250,,2015-05-01T23:10:21Z,Very good for what it is,A,A
270,542203931,this app is for some kind of stalker but if your a mom don&#39;t do it your kids will hate you forever,59333,,1186237362,,2015-04-21T22:56:19Z,horrible,A,V
276,542203931,"This is basically a stalker app for moms!! Your moms can watch your every move! Literally, it pinpoints you!!! I HATE THIS APP",59397,,1050028905,,2014-08-20T13:14:43Z,STALKER!!!,A,V
101,1212520608,Have y'all considered not spying on your kids? Putting a tiny bit of faith in them? Giving them privacy? Creeps,60264,y,1802984492,,2017-09-22T04:37:25Z,Man what,A,V
198,453761271,"My ex wasn't lucky to get away with infidelity. All thanks to globaltrackandspy @gmail who helped me hack into my Ex's phone to get evidence from call logs, emails, texts, gps and all social network conversations without me having any access to the phone which really helped me in court. He is very real and best you can trust with hacking activities.",60275,y,4909065650,,2019-10-08T13:02:47Z,Best Help I had,P,A
59,990229433,"This app is a source of spyware to make sure your children are behaving, right? Each time i see someone using this app, it is just to give a 12-13 year old an hour on their phone. The people who download this do not understand our generation and need to know that its not 1970. Everything is digital in 2019, and this app blocks more than 80% of the stuff that is used at this point in time. I want everyone to try their hardest to get this app shut down for good. Thank You",60301,,3705707323,,2019-01-28T19:28:56Z,"Horrible, Horrible App",A,V
149,990229433,I hate this app pls remove for the kids. You guys are just spying on innocent kids.,60398,,3520578477,,2018-12-11T23:36:10Z,Please remove on App Store.,A,V
106,460832645,Waste of time other users have to have same app...not a good spy app at all,62239,,558127329,,2012-04-06T09:36:55Z,Pointless,A,A
222,453761271,I love this app? I can now spy on my Gf and know where she is at all times,62886,,761862859,,2013-03-02T06:03:42Z,Great app,A,A
43,453761271,"Great app, love spying on people, lol",62904,,735987181,,2013-01-24T18:56:13Z,GPS,A,A
172,447442214,Nice spyware,63061,y,720707448,,2013-01-01T21:15:54Z,Good app,A,A
219,447442214,"Added this to my G/F's phone without telling her. Now I can spy on her. Can't wait to catch her in a lie. Where you at sweety. ""At my mother's house"". ""No your not, your at the mall, spending my money.""",63285,y,684807089,,2012-11-03T11:48:09Z,Awesome,A,A
175,453737545,I can stalk my boyfriend now. &gt;:),63304,,988109537,,2014-05-05T13:18:08Z,Awesome.,A,A
230,447442214,"This app is amazing ! This is the only app I&#39;ve ever taken time out of my day to write a review for ! It&#39;s that awesome , I also love stalking my boyfriend on this app !(;",64472,,887446426,,2013-10-26T03:23:45Z,Great app,A,A
126,447442214,This app is perfect for STALKING.,65705,,676946830,,2012-10-19T17:56:57Z,Awesome,A,A
273,447442214,Pretty cool spy on my hubby all da time!!! Ahahah great app!,65790,,666960744,,2012-09-30T14:00:02Z,Tracker app,A,A
203,447442214,Great app 4 Stalking.,66152,,580899020,,2012-05-10T22:33:22Z,Kool,A,A
35,376101648,"Every time I open this app it asks me to log back in which means it wasn't even tracking my phone in case it were lost or stolen. What do the people who made this app expect ? For the person who stole my phone to log into my phone with my password, then log into the app with my Apple ID and password which he obviously wouldn't know and then to turn the apps location on so I can finally find out where he is. Whoever made this app needs to fix this it doesn't even work properly, and was specifically made for the police and spy's to find out there suspects location without them even being aware. RIDICULOUS. It's disappointing how much these people try to take advantage of ignorant and vulnerable people just for there own benefit.",67403,y,1087423506,,2014-10-28T01:21:51Z,Dysfunctional app,P,T
26,376101648,Having to move to the mainland soon for school. I can finally stalk my gf and know where she is 100% of the time xD she does that to me too but it&#39;s pretty funny and cool and I lost my phone one time by the beach and my friend found it with the app! God bless this app!,69791,,1083153449,,2014-10-19T23:35:45Z,App is great!,A,A
155,376101648,"I downloaded this app thinking I'll never use it. Unfortunately, my phone fell out of my pocket, and I was able to trace it and follow it around the city using my brothers phone until we cornered its precise location (4 miles away from where I dropped it). Luckily, the app told us how much battery was left on my phone and thus how much time we had--and it also let us make a sound at the Taco Bell to find out whose pocket it was in. The poor old man that found my phone (and who hopefully was planning on returning it) had no idea what was happening. This app is the best, and I HIGHLY recommend it. (Small bonus: It also makes you feel like an undercover spy.)",70283,y,800274860,,2013-05-06T18:42:59Z,Definitely a must have.,P,T
252,376101648,"This app is a great to help me stalk my ex- wife,ex-girl friend and my hot coworker! He&#39;ll I stalk my neighbors 17 year old daughter on my account and they have no clue. Thanks Apple your the best!",70368,,991006284,,2014-05-11T05:15:18Z,Find my Stalked,A,A
135,376101648,The alerts are loud and rude and people can stalk you with this its bad my mom uses it to stalk me all the time and now I can&#39;t turn my phone off or it turns it off,71434,,873970745,0.018349938,2013-09-22T15:43:42Z,I hate this,A,V
11,376101648,This app is perfect for stalking ppl ;333,71952,,858586516,,2013-08-23T06:39:13Z,lol,A,A
186,376101648,I used it to spy on my boyfriend😏,72078,,856372128,,2013-08-18T23:54:26Z,Works!,A,A
145,376101648,"Visually, the redesign is...whatever. Better than the redesigned iCal on my Mac, at least.

But what bugs me about this update is that the locations are inaccurate and vary, even when the iPhone you're hunting hasn't moved. I just tried it with my boyfriend's phone (which is sitting in plain view on his nightstand), and after refreshing the map about 30 times in total, his phone was shown as being anywhere from in the apartment to three and four blocks away in any direction. A 16-square-block radius? That's not very helpful when I've lost my phone in downtown Boston. If this was a limitation of Apple's GPS technology, then fine. But before the update, this app was always pinpoint accurate. (Believe me, I've monitored my boyfriend's walk home from campus with the previous version of the app...and yes, I had his permission to do so. It was extremely accurate).

The other thing that bugs me is the location and size of the ""wipe"" button, whig is now on the map page. It's on the bottom right corner, aka the location that I always accidentally bump when I hold my phone with one hand. I don't know if there's a confirmation after pressing the wipe button (according to another reviewer, the Lock  feature doesn't), and I'm too afraid to find out. The bf might me okay with me occasionally spying on his journeys around the city with this app, but I don't think he'd appreciate it if I wiped his phone in the name of curiosity.",72616,y,661633301,,2012-09-20T08:07:12Z,Somehow less accurate than before the update,P,T
240,376101648,"I think this app is very amazing!! 😄
It's such a(n) life savor!!
I also use it to spy on my parent's!! 😏😂",73202,y,614823580,,2012-07-04T00:38:35Z,Amazing! 📱,A,A
18,376101648,I think someone should check on the girlfriend of reviewer Logan$. Sounds like he has kidnapped her after spying on her.,74330,,677416049,,2012-10-20T14:05:00Z,"Scary review ""perfect""",A,T
38,376101648,I can spy on my family !,75071,,657449889,,2012-09-12T18:46:20Z,Awesome,A,A
5,376101648,"I'm pleased with this app. Allows you to keep track of your things, plus spy on loved ones if they have the same account. Helps me find my phone when it's on vibrate. You people are impossible to please",75544,y,456855555,,2011-08-27T17:43:56Z,Works fine,A,A
252,376101648,"I think if someone wants this feature fine make it optional. Yet if you are using findmyiphone you can see if it found it or not. So this is dumb unless Apple genius =es decided they do not want people tracking people with it using like spyware -------

Ok if that is what is motivated apple to stop the use of tracking as opposed to actually using as lost iphone app then that is ok.

However you can expect a large increase in JailBroken IPHONES.

DUMB DUMB DUMB",76083,y,436025836,,2011-06-11T22:42:59Z,Emailing Notification is Stupid and Annoying I agree,P,T
