,appID,body,recordID,relevant,reviewID,score,timestamp,title,Potential or Activity,Victim/Abuser/Third
250,376101648,"I&#39;m pleased with this app. Allows you to keep track of your things, plus spy on loved ones if they have the same account. Helps me find my phone when it&#39;s on vibrate. You people are impossible to please",77899,,456855555,,2011-08-27T17:43:56Z,Works fine,A,A
162,376101648,"What's not to like?

Spy on your mate, find your phone in the couch or in a parking lot (like I did), wipe it clean remotely if IRS been stolen.

Just a small part of MobileMe. Get it!!!!",78120,y,336529013,,2010-08-13T23:19:25Z,Kicks A@@,A,A
117,376101648,"This app does what it says. I was playing around with it and was really surprised with it. I sent my iPhone a message and sound, just to test it out, and my phone instantly started beeping (even though it was on silence).  I'm really impressed. And viewing all my family members locations on the large iPad screen is awesome. It feels like something out of a spy movie :)",78285,y,307047353,,2010-06-20T13:25:30Z,Works well. Plain and simple,A,A
158,1143802529,Spying on your kids is an invasion of their privacy and of their friends if you spy on their texts. If you want to make sure they’re safe on the internet teach them about internet safety.,80503,y,3823320164,,2019-02-28T07:28:24Z,Please don’t use this,A,V
82,1143802529,"Stop spying on your kids phones, I get it you want them to be safe but that is a COMPLETE invasion of privacy to your child. And if they know you are spying on them they most likely will lose all your trust. Not only if you spy on them you are also spying on their friends, maybe their friend is gay but has homophobic parents and know you know something personal that they didn't want you to know. Or a friend texted your child opening up that they got raped, and thats not any of your business. So stop! If you want your child to show you what they are doing make a BOND, not a spy parent.",80504,y,3815919421,,2019-02-26T06:16:11Z,Stop,A,V
111,1182397829,"I used to be very frustrated with my ex indulgence in infidelity and feel sad on how to contain the situation or find out the truth. After several apps and false hackers I hired couldn't get me what I need, I was lucky to get the best service from this Real Intelligent hacker via: globaltrackandspy @ gmailcom to hack into my spouse phone since it’s a friend he’s helped that referred him. To my greatest surprise, with the help of this Genius i had access to a clone of the phone and could monitor everything on the phone completely including; Facebook, whats-app, i messages, texts, call logs, emails, deleted conversations, gps and many more. I'm so glad to have contacted the right one.",80645,y,4985321066,,2019-10-20T12:29:39Z,Best Review!,P,A
272,1182397829,"Best smartphone monitoring app ever! So far, it has kept all my ""spying"" tasks safe and secret.",80711,y,4117713358,,2019-05-08T08:44:01Z,👌,A,A
263,1182397829,Don't look any further! mSpy Lite is compatible with the latest iOS versions and can be used to track anyone's cell phone without any trouble.,80712,y,4112934543,,2019-05-07T08:55:56Z,👌,A,A
224,1182397829,"This app takes away people’s right to privacy. Especially children. I don’t care if you’re using this app to keep your kid safe. Or if you’re using it to spy on your partner. This isn’t about safety. It’s about spying. Like one user said, you will eventually push your child away from you by downloading this spying malware and because downloading this app is for spying, your child/partner will no longer trust you. By then you have a broken relationship. These positive reviews are fake. It doesn’t even track iMessage or social media. Because for one, high end social media apps like Snapchat and instagram would never allow this. It goes against their user’s privacy. My mother downloaded this on my phone. And now I don’t trust her with anything because she doesn’t trust me. Why don’t you toxic parents and people of partners take a seat and think before you do stuff?",80721,y,3989078030,,2019-04-09T04:28:20Z,Horrible.,A,V
194,572847748,It wouldn’t be so bad if you didn’t have to sign in everywhere all the time just to keep yourself safe from the people that are spying on your phone. Yes I know spyzie is on my phone and someone is watching every keystroke I make. This app claimed to erase and block it. Still hasn’t. I don’t know how many more apps I have to go through to get this spyware off my new iPhone 10XR! Frustrated!!!,81071,y,4750034444,,2019-09-08T20:37:18Z,It wouldn’t be so bad if,A,V
6,1143802529,"I signed in myself as the child AND parent just to test and see, I was going to spy on my girlfriend because I have my suspicions.... ANYWAYS, I’m pretty good at finding work around and if you’re planning on using this on a smart teen or someone tech savvy, then don’t. If you go to your settings from the child’s phone, you can EASILY remove access from the app and take away its trust permissions, deleting the profile as you have to set it as your own. But overall, it works as it’s supposed to, a little overpriced though.",82836,,4112369624,,2019-05-07T05:26:11Z,Easily Uninstall It From Childs Phone,A,A
194,1143802529,"First, I got wrangled for the 7 day fee tho g. It doesn’t have “superpowers” while trying out but does tell you about apps to worry about (you can figure this out on an instagram meme.) anyway, less than 24x7 house later I was charged an irreversible $140 to spy on my kids. Fine. But it doesn’t tell you anything g more than the home screen. Thanks dumb app. Not only am I locked into a year of the worst app, that does nothing, for $140, it also doesn’t do wa
Hat I was hoping for it to do. If you want to keep tabs on a teen (age 15-17)- and make sure what they text/save/etc is cool, this is NOT the app for you. U
If you want to prevent an 8 year old from social medi and you are dumber thN a rock, this is the app for you.",82912,,3723280283,,2019-02-02T07:25:49Z,This app,A,A
54,1143802529,I love this app. I can use it to stalk my kids and other relatives and what they are saying! Love it,82971,,2733766734,,2018-06-20T20:32:05Z,Perfect,A,A
79,1182397829,This is stupid this is basically spying on us we won’t have any freedom if u have your boyfriend or girlfriend or mom on this...whoever made this should be a shame,83380,,1940608214,,2017-11-22T17:37:24Z,I hate this app,A,V
48,875252906,An app to spy on your children under the ruse of keeping them safe! Come one come all to get your free app for stalking children. Isn't life great ?,100174,y,1322771494,,2016-01-26T16:08:22Z,Stalker app,A,V
58,875252906,An app to spy on your children under the ruse of keeping them safe! Come one come all to get your free app for stalking children. Isn&#39;t life great ?,102878,,1322771494,,2016-01-26T16:08:22Z,Stalker app,A,V
290,994098803,It’s kinda disturbing that there’s apps like this it’s like installing spyware onto your kids phone,105001,,2859975911,,2018-07-08T00:51:11Z,Creepy,A,T
127,914825567,"My mother added this app on my phone without my permission and made no effort to hide it. This may be good for other parents but as a child it’s not good to spy on your child. If you’re this curious, talk to them and give them privacy.",126374,,4155709314,,2019-05-15T21:12:51Z,Not my cup of tea.,A,V
197,618598211,"If it’s shutting down on you, it’s just your wireless network. Mine did that the first night, but once I rest my fiber, it worked just fine. I just use it right now to find some mice that made their way into my attic. Caught those little turds on the motion from my 4s. So, I’m happy with it. Pretty good for spying as well. Especially if you need to record a conversation. Not bad. Not bad at all.👍🏻",127544,y,2206438331,,2018-02-14T10:12:06Z,Does what they say it does.,P,T
276,618598211,"I just needed it to spy on who's tipping the garbage can, low and behold, I got the culprit. 

I easily downloaded the 1 min video, and showed it to my neighbor. 

He's not speaking to me now, lol.  Ya it's my fault your cat is nosey.",129074,y,1101834186,,2014-11-23T15:42:43Z,Works fine for me,A,A
112,618598211,"Wow!  I had an old iphone 4 that was worth very little on resell market. So I researched and discovered this great App. I then used / turned the old iPhone 4 into a ""spy"" camera and home surveillance camera. It's great!  Thanks folks. Everyone should try it.",129287,y,909538342,,2013-12-15T16:59:44Z,Good Use of old iPhone!,A,A
169,1127917970,"My mom read a book about the igenration and how we spend time on our phones way to much.
I'm 17 and I'm hardly on my phone as it is accept for creating plans for friends and get together.
FIRST this terrible app signed me out of all my apps. It was horrific and I was miserable. I had to spend hours logging back in. (The biggest reason it took a couple hours is I forgot all my passwords)

SECOND it moves all my apps around and it's really hard to find stuff.
What if I can't call 911?

THIRD
I'm honestly just not gonna buy my kids a phone now.

FOURTH
this is as close to communism in America as we know it

FIFTH
The creator of this app is most likely Kim Jung Un

SIXTH
My mom might be a KGB spy",130237,y,2997572573,,2018-07-31T18:10:15Z,Injustice,A,V
176,618598211,Awesome app can spy on people or set up in my front window,132832,,952878255,,2014-03-02T13:26:24Z,iPod remote cam,A,A
219,618598211,Now spying on my roommate is one of my 79 daily tasks.,133122,,803805808,,2013-05-13T05:56:04Z,Fantastic,A,A
251,1296178648,Be nice if app showed all movements while spying on driver of car,133564,,4403487530,,2019-07-03T03:29:02Z,Does this thing even move people on map?,A,A
229,316788259,"The free version will only let you connect via WiFi.  It's pretty much only good for using as a baby monitor or whomever you may want to ""spy"" on.  You can only use this version on your home network.

The paid version allows you to connect via 3G and WiFi.  3G is slow but still works.  The rest of the world has 4G why is the US so slow to install this upgrade?  Sure the video is a bit choppy; playing back at around 1 or 2 frames per second.  But hey, the damn thing works over the 3G network!  It's plenty clear for me to see what's going on at home.  Audio is a bit laggy too but you can adjust that in the app.  I just haven't bothered.
Also, if you're phone is connecting through the same WiFi your computer is hooked up to, the app will crash.  And there's no getting around that.  So take your phone over to your buddies place, jump on his WiFi and fire up the AirCam app there with no problems.  You just can't use the same WiFi as your computer.

Now configuring my ATT U-Verse router firewall was a real pain.  If the auto port-forwarding feature doesn't work with your router and you know absolutely nothing about IP addresses, Port configuration and firewalls, prepare to be frustrated and have plenty of time on your hands to manually configure it.  The support provided by senstic is a good reference but there are just so many different routers out there with so many variations of each that their support only provides a good basic detail of how to manually configure.  But if you can see past the obvious differences in the photos they provide, you should be able to configure it with no problem.  Otherwise call over one of your more ""computer savvy"" buds",245971,n,375005675,,2010-12-03T17:53:21Z,Works great despite what others are saying,P,T
200,1055315077,"If you want to spy on your kids with an app that lets kids go over their screen time, constantly say is compromised, mainly focused on selling you the premium price, and let kids arbitrarily turn it off and on then this is the app for you",252368,,1543977275,0,2017-02-14T02:07:43Z,Wow,A,V
205,310633997,"Phone spy 🕵️‍♂️ made easy hack your wife WhatsApp and see all what she’s doing 
+1 (252) 543 9349
WhatsApp 👆",266413,n,3620623141,,2019-01-06T22:42:35Z,WhatsApp,A,A
98,310633997,Ever wonder why your BF/GF knows who you're talking to? There's a way they can see your chat history and contacts thru chrome app. I know because my husband is spying on me and knows who's been texting me. Beware.,289043,n,1483513311,,2016-11-13T04:06:24Z,Isn't hack free,A,V
23,310633997,"My computer is my new what's up convenience ....I don't think so
Anyone can SCAN MY CELL with QR bar code could use my account anywhere , that's what it's call spying 
Don't  like anymore",294481,n,1375563702,,2016-05-08T17:59:09Z,NO SECURE ANYMORE,P,T
219,310633997,"This is the worst update ever! Why would you do this?! It was the best app, now I can&#39;t stalk anymore lol",296397,,1551938127,,2017-02-25T03:59:00Z,New update,A,A
244,310633997,"Why?? It&#39;s very useful while reading previews without entering the group or message.....

I hate there is no privacy in what&#39;s app.... No real stealth mode... So if I enter the app to review something important while being busy, everyone who sees me in the app thinks I am just not responding.... 

STEALTH NEEDED",301807,,1450138777,0,2016-09-15T13:44:43Z,ForceTouch removed!!! :(,A,V
251,310633997,Do not use this app unless you don&#39;t mind psychos and stalkers having full access to you anytime you want. It&#39;s not worth the lack of privacy. If you use this app you are a volunteer to be victimized. You have been warn. I wish I had never used this app.,302619,,1428809382,0.015923337,2016-08-07T18:47:30Z,Stalkers dream app,A,V
271,310633997,"Google Whatsapp hacks. You'll find a few out there that when you allow access to your images and contacts that get synced to the whatsapp database. Anyone who adds you to their contacts in whatsapp can use the hack to get into your images and other private files, even spy your conversations. Will not be using this on my phone.",303753,n,1234509499,,2015-07-28T16:41:51Z,There are known hacks online,P,T
138,310633997,"Very convenient app. It&#39;s truly amazing we can reach out to love ones both family and friends through this app!
Keep doing what u doing!
How ever there is one negative about the App! The stalker look at the time stamp to monitor other people not nice please improve on that we need a sense of privacy from theses stalker",368787,,694859884,,2012-11-21T05:31:54Z,What's app,A,V
164,310633997,"No security, anyone can spy your msgs, pictures and videos",376035,n,514429743,,2012-01-19T13:36:06Z,Bad,P,T
226,310633997,Please remove the &#34;online&#34; &#34;last scene&#34; status. It&#39;s annoying and meant for stalkers.,391059,,466666245,0.039960227,2011-09-29T17:59:02Z,I love this app but...,P,T
46,296273730,This is the best spy app ever. Fast push notifications and recordings,403824,y,1112202146,,2014-12-12T23:28:03Z,AWSOME!!,A,A
73,296273730,5.00 and a webcam and you've got security and spy stuff ready to go. Very cool. Only problem is that it never loads up when I'm on the 4G network. Wifi is dope.,404452,y,763566558,,2013-03-04T14:36:25Z,Icam please make it work over 4G,A,A
225,870161082,"The only problems are disappearing places (recreating them gets OLD fast), which is an app problem, and, crazy stalker people, which is a humanity problem.",405348,,1302397480,0.0488152,2015-12-18T13:45:35Z,Love this form of social media,A,V
194,296273730,"Made up word

I use it to protect my ""playroom"" well am a spy kid ( in my home ) but I have about 10 Electronic Devices in there an I now use my iPhone, iPod, and iPad to watch people

So yeah it's A+wesome",405446,y,568240892,,2012-04-22T01:04:13Z,Beastlyness,A,A
246,296273730,"This is one of THE BEST apps you can buy for the iPhone. Amazing!  I have used it for baby monitoring while out in the yard or at a neighbors house. I love the push-on-motion add on. Worth every penny if you are considering. I have also used it to monitor my home while we were in the process of selling and had many people in our home. The audio is crystal clear. You do have a little bit better video when on wifi but even on 3G it is actually just fine. I use this app with my built in web cam and with my external webcam at the same time so I can monitor both my kids at the same time. It even works with multiple cameras on multiple different computers on completely separate networks. Just use same log in and password on all cameras and on all computers and you can see all cameras at same time. I buggy recommend this if you want to monitor, or have some fun spying.",406485,y,348898174,,2010-09-15T19:18:20Z,One of the best App. Worth Every cent!!,A,A
27,296273730,"Push notification is the best thing. Hope the speed of the push notification is instant without any delay especially in the time of emergency. I saw this on the tv report when some dude saw his own home getting robbed. Decided to give it a try. This one is good. I have 2 kids so helps in monitoring them and when they grow up may be spying on them. Lol.

Update : works beautifully on 3G and also edge!!  Hate when ppl give fake reviews. I am in no way related to the company or the developer of this app.",406508,y,342836376,,2010-08-30T02:08:27Z,Amazing app.,P,T
2,296273730,"Best spy app so far
There is nothing I would change
Fast easy to use ",406513,y,342055073,,2010-08-27T22:16:42Z,Love it,A,A
290,296273730,This is an awesome app and the tech support team is great as well! A must have app for the spy in all of us lol!,406964,y,87896497,,2009-07-25T03:48:27Z,Great App!,A,A
100,1050267310,Looking for something to make sense of the ridiculous spying my spouse has been doing.... and how he was doing. After months of torment I'm finally getting sick of it and decided to beat him at his own game. So I started here. Awesome.... I typically would resort to using something like this but I did and I started with this app and it's very user friendly. Check it out if ur husband is a cheating A;&;&;&hole,410669,n,1584763833,,2017-04-09T15:00:17Z,1st time user,A,A
55,296273730,"Made up word

I use it to protect my &#34;playroom&#34; well am a spy kid ( in my home ) but I have about 10 Electronic Devices in there an I now use my iPhone, iPod, and iPad to watch people

So yeah it&#39;s A+wesome",415789,,568240892,,2012-04-22T01:04:13Z,Beastlyness,A,A
49,296273730,Awesome!!! Good for spying! Lol,416378,,489344059,,2011-12-01T03:48:17Z,Awesome app!!! :),A,A
181,296273730,"Now I can spy on my brother and cousin!

",417199,,134934441,,2009-10-17T00:06:46Z,This works FANTASTIC!,A,A
141,296273730,"Now that this app has sound, I can spy on my kids and secure my home at the same time.",417476,,41564944,,2009-03-28T11:28:46Z,Great app,A,A
299,1050267310,Excellent spy app 2 thumbs up,419215,,3509187996,,2018-12-08T21:50:24Z,,A,A
219,1050267310,Love this app works well to spy on people that are spreading lies and rumors about you because they can’t handle what they want. I recommend this app for everyone!,419323,,3374282322,,2018-11-03T01:20:34Z,Free,A,A
200,1050267310,Looking for something to make sense of the ridiculous spying my spouse has been doing.... and how he was doing. After months of torment I&#39;m finally getting sick of it and decided to beat him at his own game. So I started here. Awesome.... I typically would resort to using something like this but I did and I started with this app and it&#39;s very user friendly. Check it out if ur husband is a cheating A;&amp;;&amp;;&amp;hole,421230,,1584763833,,2017-04-09T15:00:17Z,1st time user,A,A
276,317435796,"You'll use it one time to feel that spy on your neighbor feeling only to find you don't know any of them. To make mattress worse it's all free on line. Would be a great app for a guy selling facial reconstructive surgery out of a van. Lol

Update: it did work on Aug1st but has stoped delivering any results at all.",431330,n,140057858,,2009-10-28T02:37:39Z,Silly UPDATE,P,T
19,428767956,"Neat little app that I use between my Mac, iPad, and iPod touch. Since my iPod is tiny, I place the touch somewhere when no one notices, launch Air Beam, then go to my iPad or Mac and start spying on people. Can't believe I got this app when it was free!",465994,y,454301381,,2011-08-18T18:32:42Z,Great!,A,A
182,428767956,"With this app, I can spy on my family without them knowing it! It's such an awesome app!",465996,y,453691150,,2011-08-16T16:20:04Z,Fly on the wall!,A,A
249,838848566,This app is great for stalking your friends to death and just to be a pervert (like me) 😂😂,475425,,1709872719,,2017-08-02T17:51:38Z,IDK,A,A
235,838848566,Finally a good app to locate and stalk friends!,475620,,1384360225,,2016-05-26T13:09:15Z,To the point,A,A
85,838848566,"Great app , highly recommend it to does who wish an easier way to stalk that crush or ur next murder victim.",475651,,1378300006,,2016-05-14T05:59:13Z,Great for my stalking activities,A,A
180,428767956,"With this app, I can spy on my family without them knowing it! It&#39;s such an awesome app!",476102,,453691150,,2011-08-16T16:20:04Z,Fly on the wall!,A,A
168,643496868,"Like every day my friend hangouts me and says I am spying at like 8:00 am, IM SLEEPING OMG WHAT THE HEAK. Do you think you can fix that so we can be friends again. Thanks.",554523,,1329345079,,2016-02-07T14:35:36Z,Spy glitch,A,A
20,547101144,Please bring back Spy Mode... This was one of the best features of the app.,558295,n,1398070336,,2016-06-21T14:56:50Z,Please bring back Spy Mode,A,A
122,547101144,"For reasons stated by others this mode is extremely useful beyond spying. Besides, it's pretty hard to secretly record others using a iPhone or iPad. Neither one is discreet.",558297,n,1396953447,,2016-06-19T10:49:19Z,"Bring Back ""spy mode""",A,A
90,547101144,Spy mode was a great feature.,558316,n,1357626879,,2016-04-02T23:03:27Z,Spy mode gone??,A,A
222,547101144,One fun part of this app was the spy mode while we could prank friends & family and record them & watch it later on,558342,n,1318313816,,2016-01-18T08:42:37Z,Spy mode was removed,A,A
225,547101144,no SpyMode (((((,558344,n,1317585890,,2016-01-17T00:40:16Z,No spyMode,A,A
105,547101144,"I luckily have not yet updated to 5.0. I've found spy mode to be very useful and don't want to lose it. Most recently while waiting on the subway I filmed a crazy guy that was screaming and threatening to shoot people. At one point he noticed me so I turned my phone to casually show the black screen. He saw that and I could tell from his face he thought ""ok, phone is off."" I kept recording without inciting him to focus on me. Luckily he took off, but I had clear evidence of this crazy dude had the cops showed up. Spy mode is handy! Not just for pervs, haha! Srsly, though, I'll hold on to 4.4 as long as possible or until Spy mode is restored. It could come in super handy in certain situations.",558377,n,1303059153,,2015-12-19T21:04:08Z,Still on 4.4,A,A
111,547101144,"I agree with the reviewer before me .. Why ruin a good thing??  Sorry this seems like a downgrade instead of an upgrade - I get the spycam, but is a shutter noise that ruins a video really going to help someone comply w/ an apply policy when videoing people who *know* they're being recorded?  ... Going to try avoiding this upgrade for as long as possible ...",558392,n,1301026386,,2015-12-15T16:58:20Z,Why ruin video with adding unnecessary noises??,A,A
251,547101144,"This app is very good.
I love the spy mode, I can do a bunch of things that others really don't have and it deserves 5 stars well 10 :)",558726,n,903480023,,2013-12-02T11:54:48Z,By: lily,A,A
74,547101144,Try to add the Spy Mode again,569934,,1506168899,,2016-12-21T14:56:32Z,Spy mode,A,A
245,547101144,"For reasons stated by others this mode is extremely useful beyond spying. Besides, it&#39;s pretty hard to secretly record others using a iPhone or iPad. Neither one is discreet.",569973,,1396953447,,2016-06-19T10:49:19Z,"Bring Back ""spy mode""",A,A
121,547101144,One fun part of this app was the spy mode while we could prank friends &amp; family and record them &amp; watch it later on,570018,,1318313816,,2016-01-18T08:42:37Z,Spy mode was removed,A,A
137,547101144,Where did the SPY feature go? That was just about the best thing this application had going for it. Disappointed!!!!,570034,,1308472890,,2015-12-30T10:33:25Z,Was the SPY CAUGHT?,A,A
69,547101144,"By this app, it really works. The spy mode thing is really cool.",570513,,794568014,,2013-04-26T13:32:27Z,YESSUM,A,A
241,547101144,Seriously awesome. Love the spy feature!!! Thanks guys 😘,570531,,791457274,,2013-04-20T19:01:51Z,Amazing,A,A
280,316512204,"Setup was a breeze.  Quicktime 7 pro found it easily.  Unfortunately, resolution seems much, much, lower than hoped.  Video size can not be adjusted live.  Hate to be a hater.  May work well to spy on the kids by 'accidentally' leaving iPhone in secret place.",577407,n,323850862,,2010-07-17T14:18:25Z,Resolution and image size,P,T
55,645682444,"Without them. I wouldn’t have caught my ex husband and wife. 
Spyware is a federal offense. 
So is identity theft.
And electronics theft. Etc. 
And animal abuse. 
Jail or pay. My attorney has all the evidence. 
Thank you VERIZON.",650031,n,4411640961,,2019-07-04T23:13:53Z,Top notch!,A,A
240,377304531,"voxer Is a great app if someone doesn't have a phone or even if they want to pull a prank or spy on people.
I believe is good but it's kind the same thing as another app a lot of people.
It has a lot of people on it and you don't have to send a contact request, but some people could talk to strangers and it is almost the same as (ZELLO walky talky.) With Zello you can also make chat channels, something voxer can not do.
I would say make it like a phone, but then it would be like Skype and Majic Jack. So it is like a lot of other apps on the app-store.",663030,n,720766888,,2013-01-01T23:17:02Z,voxer,P,T
