,appID,body,recordID,relevant,reviewID,score,timestamp,title,Potential or Activity,Victim/Abuser/Third
300,378450421,"This app is unlike any other one. It gives you more than what mobile me can. I got it 3 versions ago when it had a lot of potential but was still pretty buggy and basic. But now it's really starting to get good with the updates. I love that you can take a picture and am constantly spying on coworkers at my desk from my laptop. You should make it access more features on the phone, voice recorder/video/ipod.

Totally worth the 2 bucks.",580,y,352078363,,2010-09-25T01:42:02Z,Why isn't it in top 10,A,A
256,378450421,"Great App. This is what I was looking/waiting for.  Works perfectly.

BUT, like the other reviewer said, it kills the battery.

The creator has to find a way to fix this.
  
Also maybe there's a way to change the settings to let say i lost my phone. Then i go online and basically wake up the App/gps. By this it's not constantly coonecting to gps satellite that kills the batt.

This is also good to spy on someone.

Right now i have to uninstall it.",631,y,316435210,,2010-07-04T00:31:12Z,Great,P,T
107,886626229,i can spy on my child whenever i want its amazing he cant go anywhere without me knowing look,4198,y,4072888865,,2019-04-28T17:19:11Z,It's a good app..,A,A
30,886626229,"Great app for families keeping track of their kids,friends or if they just wanna be creepy stalkers.",4203,,5086003797,,2019-11-04T17:48:28Z,Love,A,A
278,886626229,App work great. Another way of spying on people.,4676,,3805982824,,2019-02-23T18:36:58Z,amazingggg,A,A
118,886626229,Now that I can spy on my wife I'll always know when she's cheating. Thank you for the divorce,4950,y,1720424219,,2017-08-09T18:42:27Z,I'm watching u,A,A
165,886626229,Now that I can spy on my wife I&#39;ll always know when she&#39;s cheating. Thank you for the divorce,5302,,1720424219,,2017-08-09T18:42:27Z,I'm watching u,A,A
95,947187941,"This app use to work well, now with the latest update devices don’t show up. I opted to pay so I wouldn’t be detected and for what it doesn’t work. Now I have to find another app or just pay for spyware so I can be sure she isn’t out on drugs while I’m working",5320,y,2831298565,,2018-07-04T02:09:36Z,No good,A,A
15,400119299,I'm only a kid just want to spy on my sister thanks but only if Its good,6024,y,901366932,,2013-11-27T18:06:58Z,Didn't try yet,P,T
69,384830320,"Honestly, as a teen, I love this app.
Now, my parents don’t even know what this app is, so you might be wondering why I have it. Well me and my friends are insane so we mostly use it to yell at each other to charge our phones but tbh I can also spy on my friends so I meannnn",6891,,5459974031,,2020-01-28T22:21:00Z,E,A,A
205,384830320,"apps like these have their good benefits but when it comes in the hands of parents who are awfully controlling and strict, it is no longer used for safety and precaution. It just becomes an app to spy on your children to see where they’re located. this app is a good app for families who genuinely care about the wellbeing of their kids, but if you’re a parent who wants to control your child's every move then you shouldn’t download this app",6945,y,4866901766,,2019-10-01T00:10:10Z,pros and cons,A,V
253,384830320,"I hate this app it’s an app used to stalk kids. Let them live there lives, whoever made this app should be ashamed of themselves. This is what make kids sneaky. Weirdos",6992,,5428682093,,2020-01-20T22:13:09Z,Terrible,A,V
216,384830320,"If your a parent and you are making your kids get this app for no reason, then you have no trust in your kids. you should always trust your kids. this app is basically a stalker app and no one should have to use it. i might as well wear my ankle tracker and be on house arrest",6995,,5428433970,,2020-01-20T20:36:06Z,Not good,A,V
228,384830320,This app doesn’t let kids be free. Teen years is a time to have fun and with ur parents stalking u it can turn into the worst years.,7279,,5357043262,,2020-01-03T21:49:20Z,I hate this,A,V
186,384830320,This app is useful to stalk my parents but honestly i’m on it more than apps like snapchat and tiktok because i have become obsessed with where my family is at all times.,7326,,5353155579,,2020-01-03T00:41:58Z,Invasion of privacy,A,A
178,384830320,Parents need to stop stalking there kids your not giving them freedom your showing them that you don’t trust them this app should be removed,7379,,5349610358,,2020-01-02T04:39:56Z,Stop stalking them,A,V
232,384830320,"absolutely horrible y’all all about STALKING YOUR CHILDREN AND FRIENDS UH UH, NO NO. i was absolutely torn when my parents told me they needed to MONITOR WHERE I GO AND WHO I SEE. i’m just trying to have fun as the trusty teenager i am but NOOOOOOOOOOOOOOOOOOOO I CANT so full on HATE THIS APP.",7489,,5337907461,,2019-12-30T09:18:14Z,horrible,A,V
165,384830320,i had an awful experience with this app. as a parent i believe that parents need to have a real trust worthy relationship with their kids instead of stalking them on this app. parents need to trust their kids more and with that comes their kids talking to them about EVERYTHING,7514,,5337199250,,2019-12-30T04:26:18Z,my review,A,V
310,384830320,I never thought being a stalker would be so cool. I know exactly where my husband is at all times. (Never really was the stalking kind). All kidding aside. This app is amazing. And my 11 &amp; 13 year olds are going to LOVE ME in the future.,7549,,5336129452,,2019-12-29T21:36:57Z,New Appreciation for the word Stalker!,A,A
116,384830320,"this app is ruining trust with parents. trust can’t be forced , it needs to be earned. spying on your kids only makes them more sneaky and rebellious , and there are reasons why children don’t speak to or trust their parents , especially with this app. if you want to avoid problems with your child , don’t watch them like a hawk with this app.",7559,,5333254799,,2019-12-29T05:23:29Z,NO trust with kids,A,V
150,384830320,Just why would someone make this app just to spy on teens,7808,,5268137411,,2019-12-13T16:16:14Z,Why,A,V
261,384830320,It is not possible to make a creepier or worse app if you are about to get this app to stalk your kids don’t because thats not at all okay this app should be illegal.,7855,,5265354358,,2019-12-12T23:26:42Z,Horrible,A,V
76,384830320,This app literally ruined my teenage years I have absolutely no privacy my parents are always stalking me now for no reason .,7866,,5265116956,,2019-12-12T21:52:33Z,Hate it,A,V
126,384830320,This app is very controlling and very stalker like. I think this is not needed because it destroys any trust a child can have with their parent/guardian. It also implies that parents don’t trust their children because their excuses are crazy.,7899,,5261868844,,2019-12-12T03:48:38Z,BAN LIFE 360,A,V
28,384830320,I can leave my phone anywhere and my parents will think I’m there. Helps me locate when they r coming home as well. Love stalking my family,7983,,5240649038,0,2019-12-06T15:51:23Z,It helps us kids too,A,A
146,384830320,"this is a whole new way of stalking people and it&#39;s disgusting. my mom already got trust issues with me and this basically makes this worst. apps like these shouldn&#39;t even exist. it makes parents OBSESS to know when, where they&#39;re kids are at and it&#39;s just not ok. it&#39;s basically stalking your kid and that&#39;s disgusting, this makes parents build up trust issues because you weren&#39;t were you were supposed to be on their accord or whatever so honestly? don&#39;t download it and just fully trust your kid and check up on them instead of being  a creep with your face glued to your screen seeing their every move. it&#39;s disgusting.",7990,,5236287670,,2019-12-05T13:35:09Z,yall need help,A,V
199,384830320,"This app is useful in regards of keeping track of people if they are lost or get kidnapped(especially useful because of recent occurrences with human trafficking). HOWEVER, I do not condone this app to be used to stalk your child and constantly keep tabs on them. That is how you create a sneaky child who will find ways to go around it. It is all about trust, my parents always knew where I was going and what I was doing. Every kid drinks at least once underage, that’s inevitable due to peer pressure. Just trust that you raised your child right and that they will be safe while out with friends. I cannot stand parents who hold their children back excessively.",8070,,5208170220,,2019-11-28T15:57:06Z,Hm,A,V
68,384830320,This is a really good app if u want to spy on your spouse I found out my boyfriend was cheating on me great app I recommend this app,8171,,5176613670,,2019-11-21T12:58:10Z,I like the app,A,A
221,384830320,"Three kids in college always driving home...this app gives me peace of mind without having to text or call while they are on the road to check on them. I love it! Don’t use it to spy though, that’s not cool.",8282,y,4569990339,,2019-08-04T22:51:27Z,Peace of Mind,P,T
269,384830320,You just got my friend grounded because we went on a walk around our neighborhood and maybe a little past that and we were safe and didn’t do anything bad but because of this gay stalker app my mom got a notification that I went past my street so thanks a lot,8331,,5114816907,,2019-11-10T01:39:51Z,Good job,A,V
92,384830320,bro this app is high key creepy. when i’m with my dad on his days my mom even mentions how she knew everything i was doing and it even made my dad creeped out. if you need this app then ngl yo wack. i don’t want my mom stalking me.,8602,,4989422036,,2019-10-21T00:01:24Z,way to easy to be stalked by out of picture parents,A,V
62,384830320,This app is focused on to narrow of a group. This company bought out Couple from Tenthbit Inc. but added nothing from that amazing app. I thought it would function as a replacement to build intimacy with my wife but this is just cold intrusive spy ware for worrisome parents. It’s like something from the Netflix Series Black Mirror. There is nothing for the “whole” family. It’s only about parents keeping track of their children’s every move. Works for that I guess. But I would be careful of the Breakdown in Trust.,8648,y,4485236115,,2019-07-19T12:27:23Z,ENDED COUPLE FOR THIS COLD APP?!,P,T
115,384830320,Only get this app to stalk ur kids if you want them to despise you &lt;3,9729,,4683216863,,2019-08-27T23:08:44Z,Nah,A,V
285,384830320,This app is garbage my mom uses this to spy on me every day. I’m a 12 year old forced to download this garbage. It makes me sick that i am constantly spied on.,9817,,4662243612,,2019-08-23T23:08:17Z,This is garbage,A,V
238,384830320,This app is great for tracking family!!! When I want to know how far away they are to spying on them this app is great for both!!,9819,,4662071363,,2019-08-23T22:15:56Z,Great!!,A,A
63,384830320,This app is the best ever because I can spy on people,10291,,4569875700,,2019-08-04T22:18:08Z,The best app,A,A
211,384830320,"I love this app, just great because you can time your day accordingly, I like my girlfriend knowing where I am and I love stalking her, we have fun with it.. it’s great to see where all you friends are. You can always turn it off but I never do",10398,,4546880137,,2019-07-31T17:11:17Z,Stalker lol,A,A
64,384830320,I love seeing where my family members are during the day. Love to spy on them.,10727,,4467553781,,2019-07-16T00:46:54Z,Love this app,A,A
289,384830320,this is the wirst invention ever like you just added a app to stalk your children?,10978,,4417492856,,2019-07-06T03:51:45Z,dude why the hell-,A,V
197,384830320,Parents use this app to stalk their kids.,11075,,4396970902,,2019-07-01T14:28:09Z,Stalker,A,V
284,384830320,This app is an invasion of kids privacy. Parents should trust their kids and not resort to stalking them. That’s how you push away your kids. My mom made me download this app and I hate it. And I hate her for making me get it. It has put a strain on our relationship as mother and daughter and she has yet to see it. She’s to wrapped up in her own mind and not worrying about how its effecting her own kids,11205,,4377556720,,2019-06-27T16:15:01Z,Why I hate the app,A,V
148,384830320,this app is ridiculous!!! i’m sorry but this app is almost a stalking mechanism. it’s not okay. you should be able to trust your kids sometimes. you shouldn’t need an app to constantly watch your kids. i think this app needs to be taken down a notch. kids can’t even have a good time anymore without their parents knowing every single thing. no way will i support this physco app,11432,,4336553262,,2019-06-19T00:51:16Z,ridiculous app,A,V
56,384830320,This is the BEST APP ever invented!!  I can keep track of my teenage daughter at all times and know if she gets in a wreck or has an emergency!!  THANK YOU!!  And no I’m not an overprotective Mother that stalks my daughter!!  This app just keeps me up to date with her!!  :),11753,,4270937484,,2019-06-06T06:06:16Z,AWESOME APP,A,A
104,384830320,"F*** this app, it’s so good my mom can literally see up my a**. It’s great if you’re trying to stalk someone, if you’re being stalked you’re 100% gonna be found.",12100,,4181671797,,2019-05-20T16:25:16Z,Good and Bad,A,V
11,384830320,"Best GPS App out there. If you have people you love and you would just like to know they are safe, this is it. If you’re an international spy such as James Bond, this is the App. A hundred different ways you can use this app beyond the obvious.",12229,y,3794906761,,2019-02-21T02:03:41Z,Best multi-use GPS out there.,A,A
150,384830320,"Kids can’t do anything with their friends without their parents watching them 24/7 this app is like spying, kids have no freedom due to this app whoever developed this app is ruining fun childhoods",12260,,4145018246,,2019-05-13T17:32:32Z,Ruins kids freedom,A,V
196,384830320,Worst app ever random people can stalk you,12575,,4087044028,,2019-05-01T22:12:50Z,Stalkers,A,V
9,384830320,"Perfect for making sure everyone in the family’s safe. Some may look at it from a different perspective like spying, but our family’s extremely close and none of us worry about others seeing where we are. Our two boys went into the mountains and high centered in the snow. The app showed us right where they were we the search and rescue team went up to get them. Keep up the great work Life360!",12819,y,3683551493,,2019-01-23T02:40:46Z,Great App! Been using for almost two years!,P,T
243,384830320,"I feel that this app is very well put together and accurate, but I don’t feel like parents should track their kids AT ALL. everyone needs a little something called trust and if you don’t have it then your kids will act out and have to become sneaky. This app is designed to track families and see everything just like the parent is with you at all times. I do have this app but only with my fiends and we don’t stalk each-other we just use it to see where everyone’s at. And Bc we are so close and we all wanted it we all got it.",12938,,4024229231,,2019-04-17T13:35:08Z,LOVE HATE RELATIONSHIP:///,A,T
287,384830320,"I can’t do anything. My parents constantly watch and stalk where i’m going. It’s horrible. Sometimes it even glitches and tells my mom i’m somewhere when i’m not even close to there. This app is awful and parents should trust their own child to go where they say they are going without staking them everywhere, just like when our parents were children. This app is an invasion of privacy.
WHOEVER CREATED THIS APP. F U. 🖕🏼🖕🏼🖕🏼🖕🏼🖕🏼🖕🏼",13447,,3938257718,,2019-03-28T19:56:17Z,INVASION OF PRIVACY AND PEOPLE,A,V
108,384830320,Good if you enjoy stalking your kids and not letting them live a little,13847,,3859508925,,2019-03-09T04:30:01Z,Well,A,V
167,384830320,Great stalking app 😂❤️,14026,,3826802662,,2019-03-01T05:14:09Z,Great app i get to see everything my girlfriend does,A,A
284,384830320,"My family and I are all connected to this apps it’s the greatest apps ever thanks to everyone who is involved developing this apps, I see a few others out their as well but nothing compare to this one, I highly recommend to everyone I know, I was actually looking for a spy apps for my kids while they’re at school I can Watched & listen and this is the closest thing, just wished I could have listened to them also while they’re at school and on their way home but that is in the making, thanks again for 360apps❤️❤️❤️👍👍",14243,y,3414106276,,2018-11-13T17:27:06Z,Great great apps everyone in my family connects,A,A
283,384830320,This is one of the best apps now I can stalk my parents,14355,,3763337684,,2019-02-13T01:25:18Z,Stalking my parents,A,A
278,384830320,"This app was under “paid for apps not on this device”, I paid for it and my friends have been telling me my ex has spyware on my phone. He becomes abusive for no reason and accuses me of going to see other men, he was always questioning me about my whereabouts. He really hurt me. He embarrassed me. He kept all my belongings and said if I tell the police he’ll say I strolled his laptop. Please help

Afraidofdavemartinex",14774,y,3299313118,,2018-10-14T03:35:44Z,Please tell me how to get it off my phone,A,T
120,384830320,"i hate this app so much it’s not even funny. my mom stalks me now, thanks!!!",14823,,3679497361,,2019-01-22T01:03:49Z,hate it.,A,V
132,384830320,This app is awful I don’t understand why my family can’t trust me more often. It use to be like that and now they have to know everything I do. I know it’s “good parenting” and it’s just being a “parent” but is it really? Or are you just trying to spy on your kid because you have so little faith. Any parent that makes their kid get this is dumb. no. If you make your child get this you are stupid and I will stand by that claim. Never once has this actually come in handy. You know why? Because I don’t do dumb stuff. I don’t understand never in my life have I gone out and do something stupid. But one day my mom decided that we all should get this because “Then you don’t need to check in with me” LIE! Haha she still asks where I am even though when I ask her why I need this app she says that it’s good because you don’t need to check in with me anymore. And if you think I’m calling my mom stupid you would be partial right. In this instance it’s stupid. I hate this app. The people that made it can be buried under a prison for all I care.,14867,,3668509446,,2019-01-19T10:18:19Z,Hate you Life360,A,V
100,384830320,This is just a stupid app for people to spy on their kids with. Its not use for protection.,15087,,3627004959,,2019-01-08T16:44:32Z,Stupid,A,A
216,384830320,This is a really nice app that I like to track people on!! I love to stalk my friends!!!! Lololol jk!!! 🤪,15407,,3584487204,,2018-12-28T17:48:53Z,YEET,A,A
128,384830320,Whoever created this is an idiot lol... This is a great app for strict parents so you can stalk your kids because you don’t trust them. So if you want your kid to hate you GO AHEAD and get this app.,15661,,3534175877,,2018-12-15T16:59:23Z,Really?,A,V
61,384830320,Makes spying on my fiancé so much easier. Have the app hidden on her phone so she doesn’t even know I’m keeping tabs on everywhere she goes. A lot easier to find out if she’s whoring around on me and ganged by 3 dudes.,16163,,3428620311,,2018-11-17T15:13:30Z,Amazing,A,A
259,384830320,"I love to stalk my family, therefore I love this app",16215,,3414719474,,2018-11-13T22:09:17Z,❤️,A,A
127,384830320,Life 360 helps me know exactly where my family is and I love to stalk them!! 👌,16264,,3403889498,,2018-11-11T00:21:16Z,This app is amazing,A,A
277,384830320,This app is for stalker parents,16997,,3253619081,,2018-10-02T01:41:23Z,Stalkers,A,V
255,384830320,I love this app safe fun and awesome so I spy on people lalalala BAM IN YO FACE PEOPLE HAHAHAHA 🤗,17214,,3215290732,,2018-09-22T00:12:11Z,I GET TO SPY ON PEOPLE,A,A
119,384830320,"My daughter calls it stalker app, lol.  But for a parent this is a peace of mind.  Love it.",17310,,3196775784,,2018-09-16T18:06:54Z,Peace of mine,A,A
44,384830320,It’s really cool how you could spy on your mom,17490,,3164614608,,2018-09-07T19:01:45Z,Spying on your mom,A,A
25,384830320,This app is literally legalized stalking,17720,,3126842665,,2018-08-29T01:55:15Z,Review,A,T
287,384830320,I feel like a prisoner my mom knows everywhere i go there is this thing called trust but apparently my mom doesn’t have that she stalkes me with this app and I feel like I can’t have any privacy,17762,,3120532604,,2018-08-27T11:54:39Z,Very bad,A,V
50,384830320,As a teenager we should have freedom most parents are downloading this app to watch there kids 24/7 well think of it like this as a teenager you wanted freedom to hang out with your friends and mature on your own kids have to learn from there mistakes so don’t take there freedom away by spying on them all day the app is POINTLESS unless you want your kid to not be able to go out and have fun with there friends,17811,,3110891481,,2018-08-25T05:45:50Z,Teens need to have freedom,A,V
79,384830320,This app is great for parents who really just wanna spy on their kids and ruin having fun 5/5 stars!!!!,17996,,3072724527,,2018-08-16T13:34:43Z,Must have for KGB parents!,A,V
144,384830320,This app is retarded and shouldn’t even be an app cause people can LITERALLY SPY ON YOU,18234,,3002568812,,2018-08-01T20:00:11Z,Never get this!!!!!,A,V
131,384830320,"Preface: I am a parent of two teenagers.

This is the most intrusive and horrid concept ever. If you don’t trust your family members to the point of having to track their every move, including their rate of speed and braking patterns, then there is something terribly broken in your life. All this app does is tell your family how much distrust there is between you. Got a cheating spouse? Track their every move! Got a teenager you want to micromanage and control their every step? Track them! Sometimes we need to learn to trust. Yes, I share my location with my family and vice versa with the Find my Friends app, but we don’t get notifications of every single action taken (this app here sends you notifications even if you brake hard). And we don’t spend all day checking up on each other. I get safety concerns and whatnot, but this takes insecurities and distrust to a new level. Frankly, I find it disgusting and disgraceful that people have sank so low that they have resorted to spying on their own families. If teenagers aren’t given trust then how will they ever learn to trust others?",18813,,2813115438,,2018-07-01T15:16:57Z,Family Sharing Spyware,A,T
217,384830320,if you want your kids to hate you then you should download this app. if you want to know where they are just use find my friends. this app is so overboard its insane. its almost like stalking,18923,,2768646393,,2018-06-25T19:05:09Z,Hellicopter parent app,A,V
105,384830320,"this app is horrible. I hate it it’s the stupidest app ever invented. If you have psycho parents who control every breathe you take then this will make your life even more of a living hell. This app not only just tracks ur exact coordinates it tracks your speed, battery percent, whether u try to turn the app on and off. This is stalking it is not “helpful” this makes parents trust their kids even less and makes kids want to sneak around more. Maybe if kids felt like they could trust their parents and not have to have an app tell their parents every step they take, life might be a little bit more bearable. Because of this app, i have not been able to go to bonfires or go to the mall with friends or have sleepovers because my mom has been so psycho about tracking how fast i go on the highway and why it took so long for me to get home after school bc i stopped at the gas, i have no social life. i rarely get the opportunity to leave the house besides school and work. So thank you life360 for making my mom trust me even less when i barely get to go out to being with!!!",19451,,2599497161,,2018-05-26T16:05:14Z,"if you’re trying to ruin your children’s social life, then this is the app for you.",A,V
102,384830320,Doesn’t even deserve a star it’s used to spy on your kids and family members and a waste of money,19510,y,1966354345,,2017-12-03T04:03:11Z,Less than 1 star,A,T
132,384830320,"honestly if you want your kid to rebel against you even more, this is the app for you! This app has truthfully ruined my teenage years all because my mother now has a way of tracking me down 24/7. I couldn’t do the normal teenage things because I was being stalked all day. You parents didn’t have to go through this because you didn’t have this type of technology when you were growing up, so you don’t know what it’s like. And if you are a parent that gets this app, you’re the worst type of parent. And to whoever created this app: you’re the worst person on the planet Earth and every teenager absolutely hates you. Thank you!",19510,,2578722840,,2018-05-21T23:06:38Z,Should be called “Life Ruiner”,A,V
106,384830320,I LOVE THIS APP TOTALLY RECOMMEND IF YOU WANT TO STALK YOUR MAN/ FRIENDS AND FAMILY. LOVE IT❤️,20056,,2431141676,,2018-04-17T00:01:34Z,Beans,A,A
183,384830320,This app ruined my life bc im stalked 24/7 by my parents,20335,,2339803383,,2018-03-24T04:43:59Z,😩😩😩,A,V
